{
  "schema_version": 1,
  "name": "m8a-production",
  "roster": "docs/implementation/contracts/boot-roster.md",
  "configuration": {
    "path": "model/config/verifiedos.json",
    "sha256": "7ff6f9dec6fbe0c164d52eea4862cc2cd29fd5d73fe59f498ca6011a1b6f88c2"
  },
  "producers": [
    {
      "id": "offline-reference-composer",
      "sources": [
        {
          "path": "tools/vos/composer.py",
          "sha256": "71b49958eb14d5bcb65e0c2217137833858b54a12241df42eeb2753d1b028dfc"
        }
      ]
    },
    {
      "id": "offline-reference-admission",
      "sources": [
        {
          "path": "tools/vos/admission.py",
          "sha256": "d7ab6be61f72f62daa3493c4affbfbb20de4492e2a76ddf14967c5ef7623cdbb"
        }
      ]
    }
  ],
  "members": [
    {
      "id": "rot-firmware",
      "package_id": "rot-firmware",
      "producer": null,
      "sources": [
        {
          "path": "proofs/RotFirmware.v",
          "sha256": "b8f6cd538fdf6082eb45b4cba6d94c6a65e805db9c9bcf5a7f9c8333658a71dc"
        },
        {
          "path": "proofs/RomVerifier.v",
          "sha256": "cc3bfc4c7b461048075afccd0718ab3eda8cd853307cb62deb83248a0a6f2663"
        },
        {
          "path": "proofs/Keccak.v",
          "sha256": "231f8a2e9cc3f022e3647ef04d17a2e56fbb2b54ea7bcb10ae76d5caf52f4592"
        }
      ],
      "descriptor": {
        "path": "tools/composer/packages/rot-firmware.json",
        "sha256": "e69d1407bd2824e634fbf97394e250bda2f1c2bca145bfc3b09f12d826802c5e"
      },
      "artifact_slot": "rot-firmware-artifact",
      "entry": null,
      "placement": null,
      "admission_tier": null,
      "derivation": {
        "slot": "rot-firmware-derivation",
        "source": null
      },
      "imports": {}
    },
    {
      "id": "mmode-firmware",
      "package_id": "mmode-firmware",
      "producer": null,
      "sources": [
        {
          "path": "proofs/MModeFirmware.v",
          "sha256": "9e4f93790feb8709b506fcca022d39b4a61dad9bef7d3d36ad753419bce0e1a5"
        }
      ],
      "descriptor": {
        "path": "tools/composer/packages/mmode-firmware.json",
        "sha256": "45c192f08b30b155b57ff8460506462acf4ac24ad62aeb9fc24e765d0ba07225"
      },
      "artifact_slot": "mmode-firmware-artifact",
      "entry": null,
      "placement": null,
      "admission_tier": null,
      "derivation": {
        "slot": "mmode-firmware-derivation",
        "source": null
      },
      "imports": {}
    },
    {
      "id": "kernel",
      "package_id": "kernel",
      "producer": null,
      "sources": [
        {
          "path": "proofs/KernelInstance.v",
          "sha256": "735534a2ea029f6ef9f6149852ba9141b3387adbc309b0129ee41c0fd84e676e"
        },
        {
          "path": "proofs/PartitionContext.v",
          "sha256": "37cf5f98c90d4e67ca1c43d388e29b4d826e6896150d76e1fc98e782eaa8c976"
        },
        {
          "path": "proofs/CyclicExecutive.v",
          "sha256": "c6246b6a5828de333a08f1140ff63003c5722d54ec88d5a9dd3ab60cff96c3b0"
        }
      ],
      "descriptor": {
        "path": "tools/composer/packages/kernel.json",
        "sha256": "736c07be2c992a9f728e1956a9504d295790848aeb190c52f9290fa024d5663d"
      },
      "artifact_slot": "kernel-artifact",
      "entry": null,
      "placement": null,
      "admission_tier": null,
      "derivation": {
        "slot": "kernel-derivation",
        "source": null
      },
      "imports": {}
    },
    {
      "id": "supervisor",
      "package_id": "supervisor",
      "producer": null,
      "sources": [
        {
          "path": "proofs/SupervisionTree.v",
          "sha256": "b9542c049fcabc9083096ce21ac18a19a8de657828b0563f14d4b04b5686ac51"
        },
        {
          "path": "supervisor/src/manifest.c",
          "sha256": "825bf58cb0c62d82a4e56dcea8156ab65212dbeef41d7085751a47d08421630d"
        }
      ],
      "descriptor": {
        "path": "tools/composer/packages/supervisor.json",
        "sha256": "2165b00c21b20aecff157be57a3452b0d45f91060330f25928f163e1cbe87afd"
      },
      "artifact_slot": "supervisor-artifact",
      "entry": null,
      "placement": null,
      "admission_tier": null,
      "derivation": {
        "slot": "supervisor-derivation",
        "source": null
      },
      "imports": {}
    },
    {
      "id": "crypto-core",
      "package_id": "crypto-core",
      "producer": null,
      "sources": [
        {
          "path": "proofs/Keccak.v",
          "sha256": "231f8a2e9cc3f022e3647ef04d17a2e56fbb2b54ea7bcb10ae76d5caf52f4592"
        },
        {
          "path": "proofs/Sha256.v",
          "sha256": "2ff6dd7481b56fbb6dc6fc9267590e591ffe30bf07114fae8191319ace7aca0c"
        },
        {
          "path": "proofs/AesGcm.v",
          "sha256": "a1117410ed352177164d78f3f928339e499af6e55a38d6328eb3021af459988d"
        },
        {
          "path": "proofs/MlDsa.v",
          "sha256": "70d8785b066fdee5fe5461885ee17c2006e87b268519488505b19dbd87facac2"
        }
      ],
      "descriptor": {
        "path": "tools/composer/packages/crypto-core.json",
        "sha256": "1f503ef7baff4603fe41007a38e3b0b89b79e2af2e540bbbd145a6410064d2ed"
      },
      "artifact_slot": "crypto-core-artifact",
      "entry": null,
      "placement": null,
      "admission_tier": null,
      "derivation": {
        "slot": "crypto-core-derivation",
        "source": null
      },
      "imports": {}
    },
    {
      "id": "storage",
      "package_id": "storage",
      "producer": null,
      "sources": [
        {
          "path": "proofs/ExecutableIndex.v",
          "sha256": "5b2a2a8c38ec44c3c8d2c325961d1648e1d5e3b542721b98352ab27e0c0c5d92"
        },
        {
          "path": "proofs/JournalIndex.v",
          "sha256": "0f21ba600cbdf4bfd7efaa6af6d772ed93d51f9092daa454dd3616da2dc2bb74"
        },
        {
          "path": "proofs/StorageRecovery.v",
          "sha256": "789d4702371963d7bd079498438394c6f6e5c199ee0dee67578a5acf66fdd1a6"
        }
      ],
      "descriptor": {
        "path": "tools/composer/packages/storage.json",
        "sha256": "beb6f0a9a67b59ab79fd5ead520e313b3ebcfb9a596524b5cfa18ffb28b7874e"
      },
      "artifact_slot": "storage-artifact",
      "entry": null,
      "placement": null,
      "admission_tier": null,
      "derivation": {
        "slot": "storage-derivation",
        "source": null
      },
      "imports": {}
    },
    {
      "id": "copy-service",
      "package_id": "copy-service",
      "producer": null,
      "sources": [
        {
          "path": "proofs/CopyRingService.v",
          "sha256": "19551a8bae53c432f804c8d68020dffdef1cf7bd0cb47f4b35d0b72c90342a19"
        },
        {
          "path": "proofs/RingContract.v",
          "sha256": "b29c5da0e6e1608f7ed5b4c3be1f107679d405d16455ad73eedfa68e8f6913bc"
        }
      ],
      "descriptor": {
        "path": "tools/composer/packages/copy-service.json",
        "sha256": "6edf847297aa75b2976d329d438ad0162ae022c6d4bf1f61ed455fd140e80d11"
      },
      "artifact_slot": "copy-service-artifact",
      "entry": null,
      "placement": null,
      "admission_tier": null,
      "derivation": {
        "slot": "copy-service-derivation",
        "source": null
      },
      "imports": {}
    },
    {
      "id": "composer",
      "package_id": "composer",
      "producer": "offline-reference-composer",
      "sources": [
        {
          "path": "proofs/HandlerGraph.v",
          "sha256": "2353a27a43e88f37484450335df834ba945bae2900055e94777e06189a02dfcd"
        },
        {
          "path": "tools/vos/composer.py",
          "sha256": "71b49958eb14d5bcb65e0c2217137833858b54a12241df42eeb2753d1b028dfc"
        }
      ],
      "descriptor": {
        "path": "tools/composer/packages/composer.json",
        "sha256": "27de3485ee3089f1448741048cd62781b1f946e5ee764600aaeaacdaafae1b33"
      },
      "artifact_slot": "composer-artifact",
      "entry": null,
      "placement": null,
      "admission_tier": null,
      "derivation": {
        "slot": "composer-derivation",
        "source": null
      },
      "imports": {}
    },
    {
      "id": "admission",
      "package_id": "admission",
      "producer": "offline-reference-admission",
      "sources": [
        {
          "path": "proofs/AdmissionPath.v",
          "sha256": "acb3d68026bfd38df2a4fed05efabbea6eea4929e370d112b28929c437ffd539"
        },
        {
          "path": "tools/vos/admission.py",
          "sha256": "d7ab6be61f72f62daa3493c4affbfbb20de4492e2a76ddf14967c5ef7623cdbb"
        }
      ],
      "descriptor": {
        "path": "tools/composer/packages/admission.json",
        "sha256": "c58f69a5aadeb6f38073063dc2301ffbfb0f2566d648448b21cb0f69ba407125"
      },
      "artifact_slot": "admission-artifact",
      "entry": null,
      "placement": null,
      "admission_tier": null,
      "derivation": {
        "slot": "admission-derivation",
        "source": null
      },
      "imports": {}
    }
  ],
  "startup": {
    "order": [
      "crypto-core",
      "storage",
      "copy-service"
    ],
    "dependencies": [
      {
        "member": "storage",
        "requires": "crypto-core"
      }
    ]
  },
  "supervisor": {
    "authority": [
      {
        "member": "storage",
        "requires": "crypto-core"
      }
    ],
    "policy": {
      "threshold": [
        3,
        3,
        3,
        3,
        3,
        3,
        3,
        3
      ],
      "clear_threshold": [
        1,
        1,
        1,
        1,
        1,
        1,
        1,
        1
      ],
      "respond": [
        0,
        0,
        7,
        0,
        7,
        8,
        0,
        0
      ],
      "min_dwell": 2,
      "max_interventions": 3,
      "escalation": 8,
      "backoff": [
        1,
        2,
        3,
        5
      ],
      "ceiling": 5,
      "boot_bound": 3,
      "restart_members": 7
    }
  },
  "graph": null,
  "tohost": null,
  "graph_placement": null,
  "inst_limit": null
}
